{
  "$schema": "https://json-schema.org/draft/2020-12/schema",
  "$id": "https://delivery-tools.invalid/schemas/profile.schema.json",
  "title": "Project profile (.claude/delivery-profile.json)",
  "description": "Everything specific to one repository (spec 17.1, 18). Command strings are complete; the CLI fills only {port} {sha} {pr} {spec} {dir} {cmd} {epic} {slug} {date} {project} {n}.",
  "type": "object",
  "additionalProperties": false,
  "required": ["schemaVersion", "repo", "commands", "paths", "environments", "auth", "issues", "claims", "decisions", "founder", "baseline", "audit", "limits", "release", "safetyFile"],
  "properties": {
    "schemaVersion": { "const": 1 },
    "repo": {
      "type": "object",
      "additionalProperties": false,
      "required": ["slug", "base", "branchPrefix", "worktreeRoot"],
      "properties": {
        "slug": { "type": "string", "pattern": "^[A-Za-z0-9_.-]+/[A-Za-z0-9_.-]+$" },
        "base": { "$ref": "common.schema.json#/$defs/Text" },
        "branchPrefix": { "type": "string" },
        "worktreeRoot": { "$ref": "common.schema.json#/$defs/Text" }
      }
    },
    "commands": {
      "type": "object",
      "additionalProperties": false,
      "required": ["bootstrap", "heavy", "gate", "unitCheck", "devServer", "prodBuild", "prodStart", "e2e", "previewUrl", "versionProbe", "ciWait", "stagingDeployWait", "review", "loopTest", "flight", "tried", "planner", "epicClose", "migrationsOwed", "pendingProduction", "ledgerFetch"],
      "properties": {
        "bootstrap": { "type": "string" },
        "heavy": { "type": "string" },
        "gate": { "type": "string" },
        "unitCheck": { "type": "string" },
        "devServer": { "type": "string" },
        "prodBuild": { "type": "string" },
        "prodStart": { "type": "string" },
        "e2e": { "type": "string" },
        "previewUrl": { "type": "string" },
        "versionProbe": { "type": "string" },
        "ciWait": { "type": "string" },
        "stagingDeployWait": { "type": "string" },
        "review": {
          "type": "object",
          "additionalProperties": false,
          "required": ["skill", "args"],
          "properties": { "skill": { "type": "string" }, "args": { "type": "string" } }
        },
        "loopTest": {
          "type": "object",
          "additionalProperties": false,
          "required": ["command", "when", "stagingCommand"],
          "properties": {
            "command": { "type": "string" },
            "when": { "$ref": "common.schema.json#/$defs/Strings" },
            "stagingCommand": { "type": "string" }
          }
        },
        "validateSeedJson": { "type": "string" },
        "stagingE2e": { "description": "Optional (W8): the staging E2E run after a run's merge commit is deployed ({sha}, {pr}); delivery land runs it once per merge and fails on a non-zero exit.", "type": "string" },
        "prodServer": { "description": "Optional (W6): builds and serves a production build on {port} in a build folder of its own, so the dev server keeps running; delivery shoot --prod runs it through commands.heavy, after removing its build folder.", "type": "string" },
        "prodServerBuild": { "description": "Optional: the build half of commands.prodServer. When set, delivery shoot --prod runs it to its end through commands.heavy first, and commands.prodServer then only serves (so the heavy slot is not held while the shoot runs).", "type": "string" },
        "flight": { "type": "string" },
        "tried": { "type": "string" },
        "planner": { "type": "string" },
        "epicClose": { "type": "string" },
        "migrationsOwed": { "type": "string" },
        "pendingProduction": { "type": "string" },
        "ledgerFetch": { "type": "string" }
      }
    },
    "paths": {
      "type": "object",
      "additionalProperties": false,
      "required": ["designRoot", "deliveryRoot", "runRoot", "handovers", "e2eDir", "captureSpec", "versionRoute", "messages", "appRouteGlobs", "apiRouteGlobs", "componentGlobs", "databaseTypes"],
      "properties": {
        "designRoot": { "$ref": "common.schema.json#/$defs/Text" },
        "deliveryRoot": { "$ref": "common.schema.json#/$defs/Text" },
        "runRoot": { "$ref": "common.schema.json#/$defs/Text" },
        "handovers": { "$ref": "common.schema.json#/$defs/Text" },
        "e2eDir": { "$ref": "common.schema.json#/$defs/Text" },
        "captureSpec": { "$ref": "common.schema.json#/$defs/Text" },
        "versionRoute": { "$ref": "common.schema.json#/$defs/Text" },
        "messages": {
          "type": "array",
          "items": {
            "type": "object",
            "additionalProperties": false,
            "required": ["locale", "file"],
            "properties": {
              "locale": { "type": "string", "pattern": "^[a-z]{2}(-[A-Z]{2})?$" },
              "file": { "$ref": "common.schema.json#/$defs/Text" }
            }
          }
        },
        "appRouteGlobs": { "$ref": "common.schema.json#/$defs/Strings" },
        "apiRouteGlobs": { "$ref": "common.schema.json#/$defs/Strings" },
        "componentGlobs": { "$ref": "common.schema.json#/$defs/Strings" },
        "databaseTypes": { "type": "string" },
        "sharedFiles": { "description": "Optional (W8): globs of files every run that touches a page is likely to change too (the navigation config). delivery map warns when another open run changes one.", "$ref": "common.schema.json#/$defs/Strings" },
        "migrationsGlob": { "description": "Optional. Where migrations live, e.g. supabase/migrations/*.sql. With orgScopedLists, delivery prepush checks the migrations a branch adds.", "$ref": "common.schema.json#/$defs/Text" },
        "orgColumn": { "description": "Optional. The organisation column that makes a table org-scoped (default organization_id).", "type": "string" },
        "orgScopedLists": {
          "description": "Optional. Every list a new org-scoped table must join. A list passes when some file matching files (and containing alsoContains, when set) names the table as a whole word.",
          "type": "array",
          "items": {
            "type": "object",
            "additionalProperties": false,
            "required": ["label", "files"],
            "properties": {
              "label": { "type": "string", "minLength": 1 },
              "files": { "$ref": "common.schema.json#/$defs/Text" },
              "alsoContains": { "type": "string", "minLength": 1 }
            }
          }
        }
      }
    },
    "environments": {
      "type": "object",
      "additionalProperties": false,
      "required": ["test", "previews"],
      "properties": {
        "test": {
          "type": "object",
          "additionalProperties": false,
          "required": ["name", "projectRef", "appUrl"],
          "properties": {
            "name": { "$ref": "common.schema.json#/$defs/Text" },
            "projectRef": { "type": "string" },
            "appUrl": { "type": "string" }
          }
        },
        "previews": { "enum": ["vercel", "none"] },
        "envFiles": {
          "description": "Env files every command reads at startup, relative to the repository's MAIN checkout (a worktree has no untracked .env of its own). A variable already set in the shell wins; no value is ever printed.",
          "$ref": "common.schema.json#/$defs/Strings"
        }
      }
    },
    "testData": {
      "description": "Optional (spec 18, Portability). mode tenant: fixture worlds are organisations in a shared test database (the default); database: a separate database per run; none: no seeding, every seeded state falls to component tests. robotOrganizationId: the organisation the repo's e2e robot writes to, whose rows check M14 counts before and after the PR's new e2e specs run.",
      "type": "object",
      "additionalProperties": false,
      "required": ["mode"],
      "properties": {
        "mode": { "enum": ["tenant", "database", "none"] },
        "robotOrganizationId": { "$ref": "common.schema.json#/$defs/Text" },
        "orgName": { "description": "The generic organisation name a components run's own world uses (spec components-first §3); default \"Acme Store\" when absent.", "type": "string" },
        "timeZone": { "description": "The IANA time zone the test organisations live in (e.g. Europe/Berlin). A world's relative times (today, as: date) resolve their day in it; UTC when absent.", "type": "string", "minLength": 1 },
        "timeOfDayTables": { "description": "Tables that hold time-of-day settings a page reads with the real time (e.g. opening_hours). delivery map fails a state marked clock: true whose world writes no row to one of them, so no picture depends on when the shoot runs; the world writes its minutes relative to the shoot ({\"$minuteOfDay\": \"now-60\"}).", "$ref": "common.schema.json#/$defs/Strings" }
      }
    },
    "auth": {
      "type": "object",
      "additionalProperties": false,
      "required": ["supportModule", "signInFunction", "robotAdminEmail", "robotMemberEmail"],
      "properties": {
        "supportModule": { "type": "string" },
        "signInFunction": { "type": "string" },
        "robotAdminEmail": { "type": "string" },
        "robotMemberEmail": { "type": "string" },
        "magicLinkPath": { "description": "Picture mode: the app path that exchanges a one-time sign-in token (token_hash, type=magiclink, next). Default /auth/confirm.", "type": "string", "pattern": "^/" }
      }
    },
    "issues": {
      "type": "object",
      "additionalProperties": false,
      "required": ["repo", "epicLabels", "epicType", "childLabels", "scopeLabel", "polishLabels", "subIssues", "markerPrefix"],
      "properties": {
        "repo": { "type": "string", "pattern": "^[A-Za-z0-9_.-]+/[A-Za-z0-9_.-]+$" },
        "epicLabels": { "$ref": "common.schema.json#/$defs/Strings" },
        "epicType": { "type": ["string", "null"] },
        "childLabels": { "$ref": "common.schema.json#/$defs/Strings" },
        "scopeLabel": { "$ref": "common.schema.json#/$defs/Text" },
        "polishLabels": { "$ref": "common.schema.json#/$defs/Strings" },
        "subIssues": { "type": "boolean" },
        "markerPrefix": { "type": "string", "pattern": "^[a-z0-9][a-z0-9-]*$" }
      }
    },
    "claims": {
      "type": "object",
      "additionalProperties": false,
      "required": ["mode", "verify", "pathClaims", "runLabel"],
      "properties": {
        "mode": { "enum": ["open-draft-pr", "none"] },
        "verify": { "enum": ["planner", "none"] },
        "pathClaims": { "enum": ["scope-check", "none"] },
        "runLabel": { "type": "string" }
      }
    },
    "decisions": {
      "type": "object",
      "additionalProperties": false,
      "required": ["file", "looseEnd", "handoverPattern"],
      "properties": {
        "file": { "$ref": "common.schema.json#/$defs/Text" },
        "looseEnd": { "$ref": "common.schema.json#/$defs/Text" },
        "handoverPattern": { "$ref": "common.schema.json#/$defs/Text" }
      }
    },
    "review": {
      "description": "Optional. shadowGrader: an outside decision model that delivery review asks, for every finding of a round, whether it is a code bug, a data gap or a known steer. The answers are only recorded (rounds/<n>/shadow.json); they never change a verdict, a count, an exit code or what the builder sees. keyEnv is the NAME of the environment variable that holds the API key (never the key itself).",
      "type": "object",
      "additionalProperties": false,
      "properties": {
        "shadowGrader": {
          "type": "object",
          "additionalProperties": false,
          "required": ["endpoint", "model", "keyEnv"],
          "properties": {
            "endpoint": { "type": "string", "pattern": "^https?://\\S+$" },
            "model": { "type": "string", "minLength": 1 },
            "keyEnv": { "type": "string", "pattern": "^[A-Za-z_][A-Za-z0-9_]*$" }
          }
        }
      }
    },
    "retro": {
      "description": "Optional. Where delivery retro finds the plugin checkout it may change through PRs, and that repo's GitHub name. DELIVERY_PLUGIN_REPO and DELIVERY_PLUGIN_GH override these. A path under ~/.claude/plugins/cache is always refused.",
      "type": "object",
      "additionalProperties": false,
      "properties": {
        "pluginRepo": { "type": "string" },
        "pluginRepoSlug": { "type": "string" }
      }
    },
    "founder": {
      "type": "object",
      "additionalProperties": false,
      "required": ["github", "reportFormat", "mergesOwnPRs"],
      "properties": {
        "github": { "$ref": "common.schema.json#/$defs/Text" },
        "reportFormat": { "const": "tldr" },
        "mergesOwnPRs": { "type": "boolean" }
      }
    },
    "baseline": {
      "type": "object",
      "additionalProperties": false,
      "required": ["discriminators"],
      "properties": { "discriminators": { "$ref": "common.schema.json#/$defs/Strings" } }
    },
    "audit": {
      "type": "object",
      "additionalProperties": false,
      "required": ["widths", "phoneWidth", "themes", "primaryLocale", "roles", "bannedWords", "developerPhrases", "sameAsEnglishOk", "dateShape"],
      "properties": {
        "widths": { "type": "array", "minItems": 1, "items": { "type": "integer", "minimum": 200 } },
        "phoneWidth": { "type": "integer", "minimum": 200 },
        "themes": { "type": "array", "minItems": 1, "uniqueItems": true, "items": { "enum": ["light", "dark"] } },
        "primaryLocale": { "type": "string", "pattern": "^[a-z]{2}(-[A-Z]{2})?$" },
        "roles": { "type": "array", "minItems": 1, "uniqueItems": true, "items": { "$ref": "common.schema.json#/$defs/Role" } },
        "bannedWords": {
          "type": "object",
          "propertyNames": { "pattern": "^[a-z]{2}(-[A-Z]{2})?$" },
          "additionalProperties": { "$ref": "common.schema.json#/$defs/Strings" }
        },
        "developerPhrases": { "$ref": "common.schema.json#/$defs/Strings" },
        "sameAsEnglishOk": { "$ref": "common.schema.json#/$defs/Strings" },
        "dateShape": { "$ref": "common.schema.json#/$defs/Text" }
      }
    },
    "limits": {
      "type": "object",
      "additionalProperties": false,
      "required": ["builderParallel", "subagentCommandMinutes", "maxCuts", "overSizeHours", "maxAcceptedP2PerGroup", "maxAcceptedP2", "maxPropOrUnseedablePct", "maxFixWaves", "spotRecapturePct"],
      "properties": {
        "builderParallel": { "type": "integer", "minimum": 1 },
        "subagentCommandMinutes": { "type": "number", "minimum": 1 },
        "maxCuts": { "$ref": "common.schema.json#/$defs/Count" },
        "overSizeHours": { "type": "number", "minimum": 0 },
        "maxAcceptedP2PerGroup": { "$ref": "common.schema.json#/$defs/Count" },
        "maxAcceptedP2": { "$ref": "common.schema.json#/$defs/Count" },
        "maxPropOrUnseedablePct": { "type": "number", "minimum": 0, "maximum": 100 },
        "maxFixWaves": { "$ref": "common.schema.json#/$defs/Count" },
        "spotRecapturePct": { "type": "number", "minimum": 0, "maximum": 100 }
      }
    },
    "release": {
      "type": "object",
      "additionalProperties": false,
      "required": ["tagFormat", "prodTitlePrefix", "mergeMethod"],
      "properties": {
        "tagFormat": { "type": "string" },
        "prodTitlePrefix": { "type": "string" },
        "mergeMethod": { "const": "merge-commit" }
      }
    },
    "safetyFile": { "$ref": "common.schema.json#/$defs/Text" },
    "components": {
      "description": "Optional (components-first spec §2). Absent: components are not configured, and every components-first feature is off.",
      "type": "object",
      "additionalProperties": false,
      "properties": {
        "map": { "description": "Path to the committed component map, e.g. docs/delivery/components.json.", "$ref": "common.schema.json#/$defs/Text" },
        "baseDir": { "description": "The shadcn-style base components directory, e.g. apps/web/src/components/ui.", "$ref": "common.schema.json#/$defs/Text" },
        "baseLibraries": { "description": "Import specifiers that count as a base component's own library, e.g. \"@radix-ui/*\".", "$ref": "common.schema.json#/$defs/Strings" },
        "galleryRoute": { "description": "The built gallery page's route, e.g. /admin/design/components.", "type": "string", "pattern": "^/" }
      }
    },
    "picture": {
      "description": "Optional (W7, the shoot's crop). tabBar: the CSS selectors of the app's phone tab bar, the only bottom bars the shoot hides (without it, a full-width bar fixed to the bottom and at most 160 px tall is hidden, never a sheet or dialog). keepPhoneHeader: keep the phone header in both pictures instead of cutting everything above the page title.",
      "type": "object",
      "additionalProperties": false,
      "properties": {
        "tabBar": { "$ref": "common.schema.json#/$defs/Strings" },
        "keepPhoneHeader": { "type": "boolean" },
        "prodDistDir": { "description": "The build folder commands.prodServer (or prodServerBuild) writes, relative to the repo root; delivery shoot --prod removes it before building, so an interrupted build cannot leave a partial folder. When absent it is read from the command's `cd <dir>` and NEXT_DIST_DIR=<name>.", "type": "string", "minLength": 1 }
      }
    },
    "ui": {
      "description": "Optional. themeStorageKey: the localStorage key the app keeps its theme preference in (next-themes' storageKey, e.g. app-theme); a shoot of a state with a colorScheme writes it before every navigation, so a stored preference cannot override the scheme.",
      "type": "object",
      "additionalProperties": false,
      "properties": {
        "themeStorageKey": { "type": "string", "minLength": 1 }
      }
    },
    "smoke": {
      "description": "Optional (delivery smoke, the page-load gate). skeleton: the CSS selectors of the loading placeholders the app shows until its data arrives; a page still showing one 10 s after it loaded is broken. Default [aria-busy=true] and [data-skeleton].",
      "type": "object",
      "additionalProperties": false,
      "properties": {
        "skeleton": { "$ref": "common.schema.json#/$defs/Strings" }
      }
    },
    "design": {
      "description": "Optional (components-first spec §8.2).",
      "type": "object",
      "additionalProperties": false,
      "properties": {
        "forbiddenNames": { "description": "Names that must never reach a design brief or its attachments (customers, prospects).", "$ref": "common.schema.json#/$defs/Strings" }
      }
    },
    "ci": {
      "type": "object",
      "additionalProperties": false,
      "properties": {
        "knownRed": {
          "description": "Workflows that fail on this repo's PRs for a reason no branch can fix, each with the issue tracking it. CI counts as green only when these are the only failures and every other run on the head finished clean; the output names each one every time.",
          "type": "array",
          "items": {
            "type": "object",
            "additionalProperties": false,
            "required": ["workflow", "issue", "why"],
            "properties": {
              "workflow": { "$ref": "common.schema.json#/$defs/Text" },
              "issue": { "type": "integer", "minimum": 1 },
              "why": { "$ref": "common.schema.json#/$defs/Text" }
            }
          }
        }
      }
    }
  }
}
